,tweet_id,timestamp,text,rating_numerator,rating_denominator,name,dogs_period,retweet_count,favorite_count,user_count
1556,871032628920680449,2017-06-03 15:55:36 ,"This is Boomer. He's doing an advanced water takeoff. The opposite of Sully. Ears for control, mlem for style. 13/10 simply breathtaking https://t.co/noNpY2Laoo",13.0,10,Boomer,,3401,20993,8946077
1557,727286334147182592,2016-05-02 23:59:09 ,I swear to god if we get sent another Blue Madagascan Peacock we'll deactivate. We ðŸ‘ Only ðŸ‘ Rate ðŸ‘ Dogs... 9/10 https://t.co/bbta2Q4URK,9.0,10,None,,785,2951,8946139
1558,870804317367881728,2017-06-03 00:48:22 ,Real funny guys. Sending in a pic without a dog in it. Hilarious. We'll rate the rug tho because it's giving off a very good vibe. 11/10 https://t.co/GCD1JccCyi,11.0,10,None,,5539,31045,8946077
1559,869227993411051520,2017-05-29 16:24:37 ,This is Gizmo. His favorite thing is standing pupright like a hooman. Sneaky tongue slip status achieved. 13/10 would boop well https://t.co/IoR3n1fiiQ,13.0,10,Gizmo,,3376,18904,8946077
1560,732005617171337216,2016-05-16 00:31:53 ,This is Larry. He has no self control. Tongue still nifty af tho 11/10 https://t.co/ghyT4Ubk1r,11.0,10,Larry,,5164,14365,8946139
1561,868880397819494401,2017-05-28 17:23:24 ,This is Walter. He won't start hydrotherapy without his favorite floatie. 14/10 keep it pup Walter https://t.co/r28jFx9uyF,14.0,10,Walter,,12937,60433,8946077
1562,737678689543020544,2016-05-31 16:14:39 ,We only rate dogs. Pls stop sending in non-canines like this Slovak Car Bunny. It makes my job very difficult. 11/10 https://t.co/VflvQLH2y5,11.0,10,None,,1264,4875,8946138
1563,737800304142471168,2016-06-01 00:17:54 ,This is Bella. She's ubering home after a few too many drinks. 10/10 socially conscious af https://t.co/KxkOgq80Xj,10.0,10,Bella,,3333,9682,8946138
1564,867051520902168576,2017-05-23 16:16:06 ,"Oh my this spooked me up. We only rate dogs, not happy ghosts. Please send dogs only. It's a very simple premise. Thank you... 13/10 https://t.co/M5Rz0R8SIQ",13.0,10,None,,7118,29882,8946077
1565,737826014890496000,2016-06-01 02:00:04 ,This is Remy. He has some long ass ears (probably magical). Also very proud of broken stick. 10/10 such a good boy https://t.co/EZx0YjPjPK,10.0,10,Remy,,1700,5105,8946138
1566,866720684873056260,2017-05-22 18:21:28 ,He was providing for his family 13/10 how dare you https://t.co/Q8mVwWN3f4,13.0,10,None,,4337,18562,8946078
1567,738156290900254721,2016-06-01 23:52:28 ,This is Storkson. He's wet and sad. 10/10 cheer up pup https://t.co/nrzvzPuTvC,10.0,10,Storkson,,618,2420,8946138
1568,866686824827068416,2017-05-22 16:06:55 ,This is Lili. She can't believe you betrayed her with bath time. Never looking you in the eye again. 12/10 would puppologize profusely https://t.co/9b9J46E86Z,12.0,10,Lili,,3123,17861,8946078
1569,738166403467907072,2016-06-02 00:32:39 ,This is Axel. He's a professional leaf catcher. 12/10 gifted af https://t.co/P8bgOMMTRs,12.0,10,Axel,,3209,8483,8946138
1570,738184450748633089,2016-06-02 01:44:22 ,"For the last time, we only rate dogs. Pls stop sending other animals like this Duck-Billed Platypus. Thank you. 9/10 https://t.co/twxYcPOafl",9.0,10,None,,1171,4201,8946138
1571,866334964761202691,2017-05-21 16:48:45 ,This is Coco. At first I thought she was a cloud but clouds don't bork with such passion. 12/10 would hug softly https://t.co/W86h5dgR6c,12.0,10,Coco,,12864,48567,8946078
1572,865718153858494464,2017-05-19 23:57:46 ,"Meet Boomer. He's just checking pup on you. Hopes you had a good day. If not, he hopes he made it better. 13/10 extremely good boy https://t.co/pozUoHLkGg",13.0,10,Boomer,,5096,23902,8946078
1573,738402415918125056,2016-06-02 16:10:29 ,"""Don't talk to me or my son ever again"" ...10/10 for both https://t.co/s96OYXZIfK",10.0,10,None,,790,3167,8946138
1574,738883359779196928,2016-06-04 00:01:35 ,When a single soap orb changes your entire perception of the universe... 10/10 https://t.co/9eCXpVExJc,10.0,10,None,,759,3207,8946138
1575,738885046782832640,2016-06-04 00:08:17 ,This is Charles. He's a Nova Scotian Towel Pouncer. Deadly af. Nifty tongue slip. 11/10 would pet with caution https://t.co/EfejX3iRGr,11.0,10,Charles,,1103,3656,8946138
1576,739485634323156992,2016-06-05 15:54:48 ,This is Kyle. He's a heavy drinker and an avid pot user. Just wants to be pupular. 6/10 I can't support this Kyle https://t.co/rRULp7XFnO,6.0,10,Kyle,,2812,6927,8946138
1577,739544079319588864,2016-06-05 19:47:03 ,This... is a Tyrannosaurus rex. We only rate dogs. Please only send in dogs. Thank you ...10/10 https://t.co/zxw8d5g94P,10.0,10,None,,20394,38238,8946138
1578,739844404073074688,2016-06-06 15:40:26 ,This is Simba. He's the grand prize. The trophy is just for participation. 12/10 would pet so damn well https://t.co/4qiuC0lXq5,12.0,10,Simba,,829,3688,8946138
1579,739932936087216128,2016-06-06 21:32:13 ,Say hello to Rorie. She's zen af. Just enjoying a treat in the sunlight. 10/10 would immediately trade lives with https://t.co/yctnFptdQ1,10.0,10,Rorie,,1040,3934,8946138
1580,739979191639244800,2016-06-07 00:36:02 ,This is Nollie. She's waving at you. If you don't wave back you're a monster. She's also portable as hell. 12/10 https://t.co/7AKdkCOlMf,12.0,10,Nollie,,5693,19353,8946138
1581,740214038584557568,2016-06-07 16:09:13 ,This is getting incredibly frustrating. This is a Mexican Golden Beaver. We only rate dogs. Only send dogs ...10/10 https://t.co/0yolOOyD3X,10.0,10,getting,,1896,6484,8946138
1582,737322739594330112,2016-05-30 16:40:14 ,Say hello to Lily. She's not injured or anything. Just wants everyone to hear her. 9/10 clever af https://t.co/3xqGVH0Dhw,9.0,10,Lily,,776,3484,8946138
1583,737310737551491075,2016-05-30 15:52:33 ,Everybody stop what you're doing and watch these puppers enjoy summer. Both 13/10 https://t.co/wvjqSCN6iC,13.0,10,None,,7142,14190,8946138
1584,868622495443632128,2017-05-28 00:18:35 ,Here's a h*ckin peaceful boy. Unbothered by the comings and goings. 13/10 please reveal your wise ways https://t.co/yeaH8Ej5eM,13.0,10,None,,4743,24633,8946077
1585,732585889486888962,2016-05-17 14:57:41 ,"When your teacher agreed on 10,000 RTs and no final but after 24 hours you only have 37... 10/10 https://t.co/sVnJfWVjUp",10.0,10,None,,751,3538,8946139
1586,732726085725589504,2016-05-18 00:14:46 ,This is Aldrick. He looks wise af. Also exceptionally fluffy. Only two legs tho (unfortunate). 11/10 would still hug https://t.co/QwiCVLPMNL,11.0,10,Aldrick,,856,3443,8946139
1587,868552278524837888,2017-05-27 19:39:34 ,"Say hello to Cooper. His expression is the same wet or dry. Absolute 12/10 but Coop desperately requests your help

https://t.co/ZMTE4Mr69f https://t.co/7RyeXTYLNi",12.0,10,Cooper,,1854,9334,8946077
1588,732732193018155009,2016-05-18 00:39:02 ,This is Ralpher. He's an East Guinean Flop Dog. Cuddly af. 12/10 https://t.co/rVOLuNRpjH,12.0,10,Ralpher,,514,2354,8946139
1589,733460102733135873,2016-05-20 00:51:30 ,This is Hermione. Her face is as old as time. Appears fluffy af tho. 11/10 pretty damn majestic https://t.co/0b41Q4DKCA,11.0,10,Hermione,,1223,4042,8946139
1590,733482008106668032,2016-05-20 02:18:32 ,"""Ello this is dog how may I assist"" ...10/10 https://t.co/jeAENpjH7L",10.0,10,None,,908,3023,8946139
1591,733828123016450049,2016-05-21 01:13:53 ,This is Terry. The harder you hug him the farther his tongue sticks out. 10/10 magical af https://t.co/RFToQQI8fJ,10.0,10,Terry,,751,3465,8946139
1592,734559631394082816,2016-05-23 01:40:38 ,When your friend is turnt af and you're just trying to chill. 10/10 (vid by @presgang) https://t.co/OufVDk23JC,10.0,10,None,,382,1447,8946139
1593,734776360183431168,2016-05-23 16:01:50 ,This is Livvie. Someone should tell her it's been 47 years since Woodstock. Magical eyes tho 11/10 would stare into https://t.co/qw07vhVHuO,11.0,10,Livvie,,513,2421,8946139
1594,734787690684657664,2016-05-23 16:46:51 ,This dog is more successful than I will ever be. 13/10 absolute legend https://t.co/BPoaHySYwA,13.0,10,None,,6058,12125,8946138
1595,734912297295085568,2016-05-24 01:02:00 ,This is Jax. He's a literal fluffball. Sneaky tongue slip. 10/10 would pet nonstop https://t.co/9MGouPwQmK,10.0,10,Jax,,509,2662,8946138
1596,867900495410671616,2017-05-26 00:29:37 ,"Unbelievable. We only rate dogs. Please don't send in non-canines like the ""I"" from Pixar's opening credits. Thank you... 12/10 https://t.co/JMhDNv5wXZ",12.0,10,None,,3772,22464,8946077
1597,867774946302451713,2017-05-25 16:10:44 ,Meet Harold.  He's h*ckin cooperative. 13/10 good work Harold https://t.co/ZYg3NZGICa,13.0,10,Harold,,6602,31525,8946077
1598,735274964362878976,2016-05-25 01:03:06 ,We only rate dogs. Please stop sending in your 31 year old sons that won't get out of your house. Thank you... 11/10 https://t.co/aTU53NNUkt,11.0,10,None,,4827,12610,8946138
1599,735635087207878657,2016-05-26 00:54:06 ,This is Dakota. He hasn't grow into his skin yet. 11/10 would squeeze softly https://t.co/IvFSlNXpgj,11.0,10,Dakota,,2258,5961,8946138
1600,735991953473572864,2016-05-27 00:32:10 ,This is Maxaroni. He's curly af. Also rather fabulous. 11/10 would hug well https://t.co/A216OjIdca,11.0,10,Maxaroni,,1103,3474,8946138
1601,736010884653420544,2016-05-27 01:47:23 ,Right after you graduate vs when you remember you're on your own now and can barely work a washing machine ...10/10 https://t.co/O1TLuYjsNS,10.0,10,None,,2860,7623,8946138
1602,736225175608430592,2016-05-27 15:58:54 ,We only rate dogs. Please stop sending in non-canines like this Alaskan Flop Turtle. This is very frustrating. 10/10 https://t.co/qXteK6Atxc,10.0,10,very,,2681,7837,8946138
1603,736736130620620800,2016-05-29 01:49:16 ,This is Chadrick. He's gnarly af 13/10 https://t.co/447tyBN0mW,13.0,10,Chadrick,,1657,4105,8946138
1604,748307329658011649,2016-06-30 00:09:04 ,"This sherk must've leapt out of the water and into the canoe, trapping the human. Won't even help paddle smh. 7/10 https://t.co/KubWEqOIgO",7.0,10,None,,693,3595,8946136
1605,855818117272018944,2017-04-22 16:18:34 ,I HEARD HE TIED HIS OWN BOWTIE MARK AND HE JUST WANTS TO SAY HI AND MAYBE A NOGGIN PAT SHOW SOME RESPECT 13/10 https://t.co/5BEjzT2Tth,13.0,10,None,,5060,25282,8946079
1606,850753642995093505,2017-04-08 16:54:09 ,"This is Kyle. He made a joke about your shoes, then stuck his tongue out at you. Uncalled for. Step the h*ck up Kyle. 11/10 would forgive https://t.co/hLQ2Ilg2uN",11.0,10,Kyle,,8572,29468,8946080
1607,850380195714523136,2017-04-07 16:10:12 ,This is Leo. He's a personal triathlon coach. Currently overseeing this athlete's push-pups. H*ckin brutal. 13/10 would do all he asks of me https://t.co/FXZQtBcnTO,13.0,10,Leo,,2459,12590,8946080
1608,757725642876129280,2016-07-25 23:54:05 ,This is Beckham. He fell asleep at the wheel. Very churlish. Looks to have a backpup driver tho. That's good. 11/10 https://t.co/rptsOm73Wr,11.0,10,Beckham,,1181,4449,8946134
1609,757741869644341248,2016-07-26 00:58:34 ,This is Leonard. He hides in bushes to escape his problems. 10/10 relatable af https://t.co/TdyGTcX0uo,10.0,10,Leonard,,3165,6723,8946132
1610,850145622816686080,2017-04-07 00:38:06 ,This is Riley. He's making new friends. Jubilant as h*ck for the fun times ahead. 11/10 for all pups pictured https://t.co/PCX25VV78l,11.0,10,Riley,,3589,15670,8946080
1611,758041019896193024,2016-07-26 20:47:17 ,Teagan reads entire books in store so they're free. Loved 50 Shades of Grey (how dare I make that joke so late) 9/10 https://t.co/l46jwv5WYv,9.0,10,None,,365,2639,8946132
1612,758099635764359168,2016-07-27 00:40:12 ,In case you haven't seen the most dramatic sneeze ever... 13/10 https://t.co/iy7ylyZcsE,13.0,10,None,,9695,18631,8946132
1613,758355060040593408,2016-07-27 17:35:10 ,This is Corey. He's a Portobello Corgicool. Trying to convince you that he's not a hipster. 11/10 yea right Corey https://t.co/NzWUrFZydr,11.0,10,Corey,,1034,3315,8946131
1614,757611664640446465,2016-07-25 16:21:11 ,This is Cooper. He tries to come across as feisty but it never works for very long. 12/10 https://t.co/AVks8DjHwB,12.0,10,Cooper,,1067,4470,8946134
1615,847251039262605312,2017-03-30 00:56:03 ,This is Furzey. He's doing an elevated sandy zoom. Adjusts ears to steer. 12/10 would pet mid flight https://t.co/zhbRIZQgnq,12.0,10,Furzey,,4117,19775,8946084
1616,758405701903519748,2016-07-27 20:56:24 ,This is Odie. He falls asleep wherever he wants. Must be nice. 10/10 https://t.co/M9BXCSDVjh,10.0,10,Odie,,1855,5096,8946131
1617,847606175596138505,2017-03-31 00:27:14 ,This is Cannon. He just heard something behind him. Fr*ckin frightened af. 12/10 don't look back just run https://t.co/WTPBWT6Ux1,12.0,10,Cannon,,3261,18112,8946084
1618,758467244762497024,2016-07-28 01:00:57 ,Why does this never happen at my front door... 165/150 https://t.co/HmwrdfEfUE,11.0,10,None,,2160,4693,8946131
1619,758474966123810816,2016-07-28 01:31:38 ,This is Brandonald. He accidentally opened the front facing camera. Playing it off rather heckin well. 11/10 https://t.co/uPUAotqQtM,11.0,10,Brandonald,,971,3715,8946131
1620,766069199026450432,2016-08-18 00:28:24 ,This is Juno. She can see your future. 12/10 h*ckin mesmerizing af https://t.co/Z69mShifuk,12.0,10,Juno,,832,4143,8946131
1621,758740312047005698,2016-07-28 19:06:01 ,Meet Boston. He's worried because his tongue won't fit all the way in his mouth. 12/10 it'll be ok deep breaths pup https://t.co/rfWQ4T9iQj,12.0,10,Boston,,1578,5619,8946131
1622,758854675097526272,2016-07-29 02:40:28 ,"This is Lilli Bee &amp; Honey Bear. Unfortunately, they were both born with no eyes. So heckin sad. Both 11/10 https://t.co/4UrfOZhztW",11.0,10,Lilli,,877,3476,8946131
1623,759047813560868866,2016-07-29 15:27:55 ,This is Spencer. He's part of the Queen's Guard. Takes his job very seriously. 11/10 https://t.co/8W5iSOgXfx,11.0,10,Spencer,,1949,6344,8946131
1624,766313316352462849,2016-08-18 16:38:26 ,This is Oscar. He has legendary eyebrows and he h*ckin knows it. Curly af too. 12/10 would hug passionately https://t.co/xuxZoObmF0,12.0,10,Oscar,,1841,6663,8946131
1625,759099523532779520,2016-07-29 18:53:24 ,Meet Toby. He has a drinking problem. Inflatable marijuana plant in the back is also not a good look. 7/10 cmon Toby https://t.co/Cim4DSj6Oi,7.0,10,Toby,,4042,14208,8946131
1626,851224888060895234,2017-04-10 00:06:42 ,"Meet Snoop. His number one passion is sticking his head out of car windows, so he purchased some doggles. Stylish af. 13/10 happy travels https://t.co/iHYfZdz444",13.0,10,Snoop,,5446,19840,8946080
1627,757400162377592832,2016-07-25 02:20:45 ,She walks herself up and down the train to be petted by all the passengers. 13/10 I can't handle this https://t.co/gwKCspY8N2,13.0,10,None,,6655,14808,8946134
1628,754856583969079297,2016-07-18 01:53:28 ,This is Winnie. She's not a fan of the fast moving air. 11/10 objects in mirror may be more fluffy than they appear https://t.co/FyHrk20gUR,11.0,10,Winnie,,2442,6737,8946133
1629,852226086759018497,2017-04-12 18:25:07 ,"Meet General. He wasn't content with the quality of his room. Requested to pupgrade, but was ignored. 14/10 look who just lost a customer https://t.co/NP5JW8LnmW",14.0,10,General,,6467,19129,8946079
1630,755110668769038337,2016-07-18 18:43:07 ,This is Watson. He trust falls on command. 13/10 it's elementary... (IG: wat.ki) https://t.co/goX3jewkYN,13.0,10,Watson,,10796,20716,8946133
1631,763837565564780549,2016-08-11 20:40:41 ,This is Alfie. He's touching a butt. Couldn't be happier. 11/10 https://t.co/gx3xF5mZbo,11.0,10,Alfie,,4045,12306,8946131
1632,756288534030475264,2016-07-22 00:43:32 ,Here's a heartwarming scene of a single father raising his two pups. Downright awe-inspiring af. 12/10 for everyone https://t.co/hfddJ0OiNR,12.0,10,None,,17201,43071,8946133
1633,756303284449767430,2016-07-22 01:42:09 ,Pwease accept dis rose on behalf of dog. 11/10 https://t.co/az5BVcIV5I,11.0,10,None,,1079,3847,8946134
1634,766693177336135680,2016-08-19 17:47:52 ,This is Brudge. He's a Doberdog. Going to be h*ckin massive one day. 11/10 would pat on head approvingly https://t.co/cTlHjEUNK8,11.0,10,Brudge,,776,3938,8946131
1635,757596066325864448,2016-07-25 15:19:12 ,Here's another picture without a dog in it. Idk why you guys keep sending these. 4/10 just because that's a neat rug https://t.co/mOmnL19Wsl,4.0,10,None,,1028,4237,8946134
1636,756651752796094464,2016-07-23 00:46:50 ,This is Gert. He just wants you to be happy. 11/10 would pat on the head so damn well https://t.co/l0Iwj6rLFW,11.0,10,Gert,,1259,4928,8946134
1637,851591660324737024,2017-04-11 00:24:08 ,Oh jeez u did me quite the spook little fella. We normally don't rate triceratops but this one seems suspiciously good. 11/10 would pet well https://t.co/BMtfCmNbnS,11.0,10,None,,3275,15588,8946079
1638,756998049151549440,2016-07-23 23:42:53 ,This is Oliver. He's an English Creamschnitzel. The rarest of schnitzels. 11/10 would pet quite firmly https://t.co/qbO5X6dYuj,11.0,10,Oliver,,1928,6141,8946134
1639,766423258543644672,2016-08-18 23:55:18 ,This is Shadoe. Her tongue flies out of her mouth at random. Can't have a serious conversation with her. 9/10 https://t.co/Tytt15VquG,9.0,10,Shadoe,,1539,5884,8946131
1640,757354760399941633,2016-07-24 23:20:20 ,"This is DevÃ³n (pronounced ""Eric""). He forgot how to eat the apple halfway through. Wtf DevÃ³n get it together. 8/10 https://t.co/7waRPODGyO",8.0,10,DevÃ³n,,1383,4420,8946134
1641,851464819735769094,2017-04-10 16:00:07 ,This is Iggy. He was a rescue dog killed in the Stockholm attack. His memorial started with a collar and four bones. It's grown a bit. 14/10 https://t.co/E4a0R9my1M,14.0,10,Iggy,,6688,23233,8946080
1642,847157206088847362,2017-03-29 18:43:12 ,"Meet Daisy. She's been pup for adoption for months now but hasn't gotten any applications. 11/10 let's change that

https://t.co/Jlb9L0m3J0 https://t.co/Eh7fGFuy6r",11.0,10,Daisy,,5568,19146,8946084
1643,852189679701164033,2017-04-12 16:00:27 ,This is Sailor. He has collected the best dirt in the area. As any good boy would. Under the impression you know what to do next. 12/10 https://t.co/jrFzScKWEG,12.0,10,Sailor,,1500,10988,8946079
1644,754747087846248448,2016-07-17 18:38:22 ,This is Keith. He's pursuing a more 2D lifestyle. Idiosyncratic af. 12/10 follow your dreams Keith https://t.co/G9ufksBMlU,12.0,10,Keith,,502,2532,8946133
1645,759197388317847553,2016-07-30 01:22:17 ,This is Luna. She's just heckin precious af I have nothing else to say. 12/10 https://t.co/gQH2mmKIJW,12.0,10,Luna,,1895,5954,8946131
1646,759447681597108224,2016-07-30 17:56:51 ,This is Oakley. He has no idea what happened here. Even offered to help clean it up. 11/10 such a heckin good boy https://t.co/vT3JM8b989,11.0,10,Oakley,,2395,8317,8946131
1647,761672994376806400,2016-08-05 21:19:27 ,Ohboyohboyohboyohboyohboyohboyohboyohboyohboyohboyohboyohboyohboyohboyohboy. 10/10 for all (by happytailsresort) https://t.co/EY8kEFuzK7,10.0,10,None,,28341,48429,8946130
1648,765669560888528897,2016-08-16 22:00:23 ,This is Tove. She's a Balsamic Poinsetter. Surprisingly deadly. 12/10 snug with caution https://t.co/t6RvnVEdRR,12.0,10,Tove,,1205,5093,8946131
1649,849776966551130114,2017-04-06 00:13:11 ,Seriously guys? Again? We only rate dogs. Please stop submitting other things like this super good hammerhead shark. Thank you... 12/10 https://t.co/TCMC90mSOT,12.0,10,None,,7184,29179,8946084
1650,765395769549590528,2016-08-16 03:52:26 ,This is my dog. Her name is Zoey. She knows I've been rating other dogs. She's not happy. 13/10 no bias at all https://t.co/ep1NkYoiwB,13.0,10,my,,3312,26175,8946131
1651,849412302885593088,2017-04-05 00:04:08 ,This is Noosh. He noticed you were in the shower and thought you could use some company. 12/10 h*ckin loyal https://t.co/Uq3ChFgWA3,12.0,10,Noosh,,2982,15264,8946084
1652,761745352076779520,2016-08-06 02:06:59 ,Guys.. we only rate dogs. Pls don't send any more pics of the Loch Ness Monster. Only send in dogs. Thank you. 11/10 https://t.co/obH5vMbm1j,11.0,10,None,,840,4193,8946130
1653,761976711479193600,2016-08-06 17:26:19 ,This is Shelby. She finds stuff to put on her head for attention. It works really well. 12/10 talented af https://t.co/WTZ484EntP,12.0,10,Shelby,,1951,5295,8946131
1654,765222098633691136,2016-08-15 16:22:20 ,This is Gromit. He's pupset because there's no need to beware of him. Just wants a pettin. 10/10 https://t.co/eSvz4EapHH,10.0,10,Gromit,,3307,11418,8946131
1655,761599872357261312,2016-08-05 16:28:54 ,"This is Sephie. According to this picture, she can read. Fantastic at following directions. 11/10 such a good girl https://t.co/7HY9RvCudo",11.0,10,Sephie,,1161,4049,8946130
1656,762035686371364864,2016-08-06 21:20:40 ,This left me speechless. 14/10 heckin heroic af https://t.co/3td8P3o0mB,14.0,10,None,,15151,31215,8946131
1657,764857477905154048,2016-08-14 16:13:27 ,This is Aubie. He has paws for days. Nibbling tables is one of his priorities. Second only to being cuddly af. 12/10 https://t.co/cBIFBsCRz6,12.0,10,Aubie,,1737,6332,8946131
1658,849336543269576704,2017-04-04 19:03:06 ,"At first I thought this was a dog because of the sign, but it is clearly Wilson from Home Improvement. Please only send in dogs... 11/10 https://t.co/jqPk1BZ6xu",11.0,10,None,,1792,10980,8946084
1659,762464539388485633,2016-08-08 01:44:46 ,This is Buddy. His father was a bear and his mother was a perfectly toasted marshmallow. 12/10 would snug so well https://t.co/zGSj1oUgxx,12.0,10,Buddy,,4058,10096,8946131
1660,849051919805034497,2017-04-04 00:12:06 ,This is Kevin. Kevin doesn't give a single h*ck. Will sit in the fountain if he wants to. 13/10 churlish af https://t.co/r6GjO6MbZz,13.0,10,Kevin,,8019,40692,8946780
1661,762471784394268675,2016-08-08 02:13:34 ,Meet Glenn. Being in public scares him. Frighteningly relatable. 12/10 keep hangin in there Glenn (Imgur - Wuhahha) https://t.co/pA4MDKwRci,12.0,10,Glenn,,6242,11000,8946131
1662,762699858130116608,2016-08-08 17:19:51 ,This is Leela. She's a Fetty Woof. Lost eye while saving a baby from an avalanche. 11/10 true h*ckin hero https://t.co/2lBg3ZgivD,11.0,10,Leela,,3519,11888,8946131
1663,763103485927849985,2016-08-09 20:03:43 ,This is Belle. She's a Butterflop Hufflepoof. Rarer than most. Having trouble with car seat. 10/10 perturbed af https://t.co/VIXT3D26VM,10.0,10,Belle,,2253,7237,8946131
1664,848690551926992896,2017-04-03 00:16:10 ,Please stop sending in animals other than dogs. We only rate dogs. Not Furry Ecuadorian Sea Turtles. Thank you... 12/10 https://t.co/UOE79zb6VU,12.0,10,None,,4106,24245,8946780
1665,764259802650378240,2016-08-13 00:38:30 ,This is Kota and her son Benedict. She doesn't know why you're staring. They are a normal family. Both 10/10 https://t.co/Q1v9BZylvZ,10.0,10,Kota,,1469,5903,8946131
1666,762316489655476224,2016-08-07 15:56:28 ,This is Scout. He specializes in mid-air freeze frames. 11/10 https://t.co/sAHmwRtfSq,11.0,10,Scout,,1084,4705,8946131
1667,759446261539934208,2016-07-30 17:51:13 ,"No no no this is all wrong. The Walmart had to have run into the dog driving the car. 10/10 someone tell him it's ok
https://t.co/fRaTGcj68A",10.0,10,None,,470,1640,8946131
1668,761334018830917632,2016-08-04 22:52:29 ,This is Bruce. I really want to hear the joke he was told. 10/10 for chuckle pup https://t.co/ErPLjjJOKc,10.0,10,Bruce,,1423,5090,8946132
1669,761292947749015552,2016-08-04 20:09:17 ,Meet Bonaparte. He's pupset because it's cloudy at the beach. Can't take any pics for his Instagram. 11/10 https://t.co/0THNOfv2Jo,11.0,10,Bonaparte,,1059,4394,8946132
1670,766008592277377025,2016-08-17 20:27:34 ,This is Angel. She stole the @ShopWeRateDogs shirt from her owner. Fits pretty well actually. 11/10 would forgive https://t.co/jaivZ1dcUL,11.0,10,Angel,,488,3679,8946131
1671,759557299618865152,2016-07-31 01:12:26 ,This is Emma. She can't believe her last guess didn't hit. Convinced ur stacking them on top of each other. 10/10 https://t.co/JRV1dhBYwu,10.0,10,Emma,,1160,4580,8946131
1672,759846353224826880,2016-07-31 20:21:02 ,This is Kirby. He's a Beneblip Cumberpat. Pretty heckin rare. 11/10 would put my face against his face https://t.co/fd6uucghY6,11.0,10,Kirby,,1916,6597,8946131
1673,759923798737051648,2016-08-01 01:28:46 ,We only rate dogs... this is a Taiwanese Guide Walrus. Im getting real heckin tired of this. Please send dogs. 10/10 https://t.co/49hkNAsubi,10.0,10,None,,5494,14395,8946132
1674,760190180481531904,2016-08-01 19:07:17 ,Meet Sadie. She's addicted to balloons. It's tearing her family apart. Won't admit she has a problem. Still 10/10 https://t.co/h6s9Rch0gZ,10.0,10,Sadie,,1749,5578,8946132
1675,760252756032651264,2016-08-01 23:15:56 ,This is Fido. He can tell the weather. Not good at fetch tho. Never comes when called. 4/10 would probably still pet https://t.co/4gOv2Q3iKP,4.0,10,Fido,,847,3870,8946132
1676,760290219849637889,2016-08-02 01:44:48 ,This is Rocco. He's doing his best. 13/10 someone help him (IG: rocco_roni) https://t.co/qFsl1nnXMv,13.0,10,Rocco,,11181,26245,8946132
1677,848324959059550208,2017-04-02 00:03:26 ,Meet Odin. He's supposed to be giving directions but he'd rather look at u like that. Should probably buckle pup. 12/10 distracting as h*ck https://t.co/1pSqUbLQ5Z,12.0,10,Odin,,4392,23813,8946084
1678,847842811428974592,2017-03-31 16:07:33 ,"This is Rontu. He is described as a pal, cuddle bug, protector and constant shadow. 12/10, but he needs your help

https://t.co/zK4cpKPFfU https://t.co/7Xvoalr798",12.0,10,Rontu,,1256,5225,8946084
1679,847962785489326080,2017-04-01 00:04:17 ,This is Georgie. He's very shy. Only puppears when called. Aggressively average at fetch. Unique front paws. Looks slippery. 10/10 would pet https://t.co/rcDs5LkiSj,10.0,10,Georgie,,4824,22672,8946084
1680,760539183865880579,2016-08-02 18:14:06 ,This is Atlas. Swinging is his passion. 12/10 would push all day https://t.co/9k8LLjJ0uJ,12.0,10,Atlas,,3528,7417,8946132
